Num;Topic;Advice;Sentence
1;Walking_at_dawn;Wear visible clothing;Make sure to wear bright clothes so others can see you.
2;Walking_at_dawn;Use a flashlight;Always carry a flashlight to light your path.
3;Walking_at_dawn;Stick to well-lit areas;Avoid dark and isolated paths during your walk.
4;Walking_at_dawn;Walk with a buddy;It’s safer to walk with a friend at dawn.
5;Walking_at_dawn;Stay alert;Keep an eye on your surroundings while walking.
6;Walking_at_dawn;Avoid headphones;Don’t wear headphones so you can hear what’s around you.
7;Walking_at_dawn;Choose familiar routes;Stick to routes you know well when it’s still dark.
8;Walking_at_dawn;Plan your route;Know where you’re going before you set out.
9;Walking_at_dawn;Keep your phone handy;Make sure your phone is charged in case of emergencies.
10;Walking_at_dawn;Trust your instincts;If something feels off, don’t hesitate to change your plans.
11;Walking_at_dawn;Notify someone;Tell someone your walking plans before you leave.
12;Walking_at_dawn;Limit distractions;Stay focused and avoid distractions while walking.
13;Walking_at_dawn;Check the weather;Dress appropriately for the dawn temperature.
14;Walking_at_dawn;Respect wildlife;Be cautious of animals that may be active at dawn.
15;Walking_at_dawn;Practice self-defense;Consider taking a self-defense class for additional safety.
16;Walking_at_dawn;Stay hydrated;Always drink water before your morning walk.
17;Walking_at_dawn;Use reflective gear;Reflective accessories can enhance your visibility.
18;Walking_at_dawn;Follow pedestrian rules;Always obey pedestrian signals and traffic rules.
19;Walking_at_dawn;Watch your step;Be careful of uneven ground and obstacles.
20;Walking_at_dawn;Remove sunglasses;Avoid wearing sunglasses that may limit your vision at dawn.
21;Walking_at_dawn;Stay aware of surroundings;Always keep an eye on what's happening around you.
22;Walking_at_dawn;Wear reflective clothing;Bright clothes help you be seen by early drivers.
23;Walking_at_dawn;Use well-lit paths;Stick to areas that are well illuminated.
24;Walking_at_dawn;Bring a friend;It's safer to walk with someone else in the morning.
25;Walking_at_dawn;Avoid distractions;Leave your phone in your pocket to stay focused.
26;Walking_at_dawn;Listen for traffic;Take out your earbuds and be alert to any vehicles.
27;Walking_at_dawn;Choose safe footwear;Wear comfortable shoes for better stability.
28;Walking_at_dawn;Know the route;Familiarize yourself with the path before you go.
29;Walking_at_dawn;Carry a whistle;A whistle can alert others if you need help.
30;Walking_at_dawn;Trust your instincts;If something feels off, it’s okay to turn back.
31;Walking_at_dawn;Check weather conditions;Make sure to dress appropriately for the morning chill.
32;Walking_at_dawn;Avoid isolated areas;Stick to places where there are other people around.
33;Walking_at_dawn;Keep valuables hidden;Don't show off any expensive items while walking.
34;Walking_at_dawn;Alert someone;Let a family member know your walking plan.
35;Walking_at_dawn;Be cautious of wildlife;Morning is when animals are often more active.
36;Walking_at_dawn;Stay hydrated;Bring a small water bottle for longer walks.
37;Walking_at_dawn;Have a charged phone;Ensure your phone is ready in case of emergencies.
38;Walking_at_dawn;Stretch before walking;Loosen up your muscles to prevent injury.
39;Walking_at_dawn;Practice good posture;Walking properly helps you avoid strain.
40;Walking_at_dawn;Stick to sidewalks;Always use sidewalks when available for safety.
41;Walking_at_dawn;Wear bright clothing;It helps you stand out in the low light.
42;Walking_at_dawn;Stay on pathways;Avoid uneven surfaces that might cause falls.
43;Walking_at_dawn;Keep your phone charged;You may need it in case of emergencies.
44;Walking_at_dawn;Listen to your surroundings;Take out your earbuds to be aware of your environment.
45;Walking_at_dawn;Walk with a buddy;It's safer and more enjoyable together.
46;Walking_at_dawn;Carry a flashlight;It can help you see and be seen.
47;Walking_at_dawn;Avoid secluded areas;Stick to well-lit and populated routes.
48;Walking_at_dawn;Be aware of wildlife;They are more active during early hours.
49;Walking_at_dawn;Wear comfortable shoes;They help prevent blisters on longer walks.
50;Walking_at_dawn;Hydrate before you leave;Staying hydrated improves your energy levels.
51;Walking_at_dawn;Stretch before walking;It helps prevent injuries from tight muscles.
52;Walking_at_dawn;Keep a steady pace;It helps maintain your stamina throughout the walk.
53;Walking_at_dawn;Inform someone of your route;It’s good for safety if someone knows where you are.
54;Walking_at_dawn;Plan your path ahead;Know where you are going to avoid getting lost.
55;Walking_at_dawn;Use reflective gear;It increases your visibility to drivers and cyclists.
56;Walking_at_dawn;Stay alert to vehicles;Always look both ways before crossing streets.
57;Walking_at_dawn;Carry minimal items;The less you carry, the easier it is to walk.
58;Walking_at_dawn;Practice good posture;It helps improve your overall gait and comfort.
59;Walking_at_dawn;Avoid using your phone;Focusing on walking reduces distractions.
60;Walking_at_dawn;Look for signs of danger;Trust your instincts if something feels off.
61;Walking_at_dawn;Wear visible clothing;Make sure you wear bright colors to be seen by drivers.
62;Walking_at_dawn;Stay on well-lit paths;Always stick to the paths that are well lit for safety.
63;Walking_at_dawn;Keep your phone handy;Have your phone ready in case you need help while walking.
64;Walking_at_dawn;Avoid distractions;Don’t use headphones so you can hear your surroundings clearly.
65;Walking_at_dawn;Walk with a buddy;It’s safer to walk with someone else, especially in the early morning.
66;Walking_at_dawn;Be aware of wildlife;Keep an eye out for any animals that might be active at dawn.
67;Walking_at_dawn;Don't rush;Take your time and enjoy the peaceful atmosphere of dawn.
68;Walking_at_dawn;Use reflective gear;Consider wearing reflective gear to increase visibility.
69;Walking_at_dawn;Practice situational awareness;Stay alert and aware of your environment while you walk.
70;Walking_at_dawn;Carry a small flashlight;Bringing a flashlight can help you navigate dark areas.
71;Walking_at_dawn;Avoid texting while walking;Keep your focus on walking instead of texting.
72;Walking_at_dawn;Know your route;Plan your route ahead to avoid getting lost in the early morning mist.
73;Walking_at_dawn;Trust your instincts;If something feels off, it’s okay to turn back or change your path.
74;Walking_at_dawn;Inform someone of your plans;Let a friend or family member know your walking route and expected return.
75;Walking_at_dawn;Look both ways at crossings;Always check for cars at street crossings to ensure your safety.
76;Walking_at_dawn;Stay hydrated;Drink water before you head out, even if it’s early.
77;Walking_at_dawn;Watch out for uneven surfaces;Be cautious of cracks in sidewalks or uneven terrain.
78;Walking_at_dawn;Use a personal alarm;Consider carrying a personal alarm for extra safety.
79;Walking_at_dawn;Avoid isolated areas;Choose routes that are populated to feel safer while walking.
80;Walking_at_dawn;Keep a steady pace;Walking at a steady pace will help you maintain your balance and alertness.
81;Walking_at_dawn;Stay visible;Wear bright clothing to be seen easily.
82;Walking_at_dawn;Choose safe routes;Avoid secluded paths that may be unsafe.
83;Walking_at_dawn;Use reflective gear;Reflective bands can help you be noticed.
84;Walking_at_dawn;Stay aware of surroundings;Keep your head up and watch for hazards.
85;Walking_at_dawn;Walk in pairs;It's safer to walk with a friend at dawn.
86;Walking_at_dawn;Listen to the environment;Keep one ear free to hear traffic and people.
87;Walking_at_dawn;Check the weather;Make sure it's safe to walk given the forecast.
88;Walking_at_dawn;Carry identification;Always have ID on you in case of emergencies.
89;Walking_at_dawn;Avoid distractions;Put your phone away while walking.
90;Walking_at_dawn;Plan your walk;Know how long your route will take.
91;Walking_at_dawn;Alert someone;Tell someone your planned route and return time.
92;Walking_at_dawn;Use sidewalks when possible;Stay on paths designed for walking.
93;Walking_at_dawn;Avoid headphones;Be aware of surrounding noises while walking.
94;Walking_at_dawn;Stay hydrated;Drink enough water before heading out.
95;Walking_at_dawn;Mind the pets;Keep dogs on leashes to avoid accidents.
96;Walking_at_dawn;Trust your instincts;If something feels off, change your route.
97;Walking_at_dawn;Watch for wildlife;Be cautious of animals that may be active.
98;Walking_at_dawn;Pace yourself;Don’t rush, especially on uneven terrain.
99;Walking_at_dawn;Know emergency contacts;Have important numbers saved on your phone.
100;Walking_at_dawn;Reflect on surroundings;Take time to appreciate the quiet morning.
101;Walking_at_dawn;Stay in well-lit areas;Remember to keep to the streets that are lit up.
102;Walking_at_dawn;Wear reflective clothing;Make sure your jacket reflects light for visibility.
103;Walking_at_dawn;Keep your phone charged;Don't forget to charge your phone before heading out.
104;Walking_at_dawn;Use a buddy system;It's safer to walk with a friend during dawn.
105;Walking_at_dawn;Be aware of your surroundings;Stay alert and pay attention to what's happening around you.
106;Walking_at_dawn;Plan your route beforehand;Have a clear idea of where you are going.
107;Walking_at_dawn;Carry a whistle or alert device;A whistle can help attract attention if needed.
108;Walking_at_dawn;Avoid shortcuts through alleys;Stick to main streets for safety.
109;Walking_at_dawn;Trust your instincts;If a situation feels off, change your path.
110;Walking_at_dawn;Know the local emergency numbers;Keep essential numbers at hand for emergencies.
111;Walking_at_dawn;Use designated pedestrian pathways;Stay safe by using walking paths when available.
112;Walking_at_dawn;Follow traffic signals;Pay attention to traffic lights and crosswalks.
113;Walking_at_dawn;Inform someone of your plan;Let a friend or family member know your route.
114;Walking_at_dawn;Limit distractions;Keep your focus on walking rather than texting.
115;Walking_at_dawn;Stay hydrated;Bring a water bottle if you plan a long walk.
116;Walking_at_dawn;Dress for the weather;Check the forecast and wear appropriate clothing.
117;Walking_at_dawn;Avoid flashy jewelry;Leave valuables at home to deter attention.
118;Walking_at_dawn;Stay calm and composed;Maintain a relaxed demeanor even in unfamiliar areas.
119;Walking_at_dawn;Use your smartphone wisely;If you need to use your phone, do it quickly and stay alert.
120;Walking_at_dawn;Stay visible;Make sure to wear bright clothing to be seen easily.
121;Walking_at_dawn;Use well-lit paths;Always choose routes that are well-lit and familiar to you.
122;Walking_at_dawn;Keep your phone handy;Having your phone charged and close can be a lifesaver.
123;Walking_at_dawn;Walk with a friend;It's safer to go out for a walk with a companion.
124;Walking_at_dawn;Wear visible clothing;Make sure to wear bright colors so others can see you easily.
125;Walking_at_dawn;Use well-lit paths;Always stick to the routes that are well lit for safety.
126;Walking_at_dawn;Stay aware of surroundings;Keep your head up and be mindful of what's around you.
127;Walking_at_dawn;Avoid distractions;Put away your phone and keep your focus on your surroundings.
128;Walking_at_dawn;Carry a whistle;A whistle can help alert others if you need assistance.
129;Walking_at_dawn;Walk with a buddy;It's always safer to walk with a friend, especially at dawn.
130;Walking_at_dawn;Trust your instincts;If something feels off, don’t hesitate to change your route.
131;Walking_at_dawn;Keep personal items secure;Make sure your belongings are safe and not easily accessible to others.
132;Walking_at_dawn;Use reflective gear;Wear reflective accessories to enhance visibility in low light.
133;Walking_at_dawn;Plan your route;Know exactly where you're going before you head out.
134;Walking_at_dawn;Avoid heavy jewelry;Don't wear flashy items that might draw unwanted attention.
135;Walking_at_dawn;Stay alert for wildlife;Keep an eye out for animals that might be active at dawn.
136;Walking_at_dawn;Hydrate before leaving;Drink enough water before your walk to stay energized.
137;Walking_at_dawn;Inform someone of your plan;Let a friend or family member know your route and expected return time.
138;Walking_at_dawn;Carry a flashlight;A small flashlight can help you see if it’s dark out.
139;Walking_at_dawn;Wear proper footwear;Choose comfortable shoes that can handle different terrains.
140;Walking_at_dawn;Check the weather;Always look at the weather forecast before heading out.
141;Walking_at_dawn;Be cautious of cars;Watch for vehicles, especially when crossing roads.
142;Walking_at_dawn;Stretch before walking;Take a few moments to stretch and warm up your muscles.
143;Walking_at_dawn;Stay calm in uneasy situations;If approached, remain calm and speak clearly.
144;Walking_at_dawn;Wear reflective clothing;Make sure to put on something bright so others can see you.
145;Walking_at_dawn;Carry a flashlight;Don't forget to bring your flashlight for better visibility.
146;Walking_at_dawn;Stay on well-lit paths;Always choose trails that are well illuminated and safe.
147;Walking_at_dawn;Watch for wildlife;Keep an eye out for any animals that might be active at this time.
148;Walking_at_dawn;Inform someone of your route;It's a good idea to let someone know where you're going.
149;Walking_at_dawn;Use headphones wisely;If you listen to music, keep the volume low enough to hear your surroundings.
150;Walking_at_dawn;Stay alert;Always stay aware of your environment while you walk.
151;Walking_at_dawn;Choose familiar routes;Stick to the paths you know well, especially in the early morning.
152;Walking_at_dawn;Avoid distractions;Put your phone away and focus on walking safely.
153;Walking_at_dawn;Walk with a buddy;It's safer to walk with a friend at dawn if you can.
154;Walking_at_dawn;Keep personal items secure;Make sure your belongings are secure as you walk.
155;Walking_at_dawn;Practice good posture;Walk with proper posture to avoid any strain.
156;Walking_at_dawn;Hydrate before walking;Drink some water before you head out to stay hydrated.
157;Walking_at_dawn;Wear suitable shoes;Choose comfortable and sturdy shoes for your morning walk.
158;Walking_at_dawn;Listen to your instincts;If something feels off, trust your gut and turn back.
159;Walking_at_dawn;Check the weather;Be aware of the morning weather to dress appropriately.
160;Walking_at_dawn;Avoid heavily wooded areas;Steer clear of dense woods where visibility might be low.
161;Walking_at_dawn;Stay in contact with friends;Keep your phone charged and stay in touch with friends.
162;Walking_at_dawn;Plan your return time;Make sure you know what time you plan to be back home.
163;Walking_at_dawn;Consider safety gear;Think about wearing a whistle or personal alarm for additional safety.
164;Walking_at_dawn;Stay Alert;Remember to always be aware of your surroundings.
165;Walking_at_dawn;Wear Reflective Gear;Make sure to wear something that will make you visible to others.
166;Walking_at_dawn;Choose Well-Lit Paths;Stick to areas that are well-lit and familiar.
167;Walking_at_dawn;Bring a Friend;It's safer to walk with someone else during early hours.
168;Walking_at_dawn;Listen to Music Cautiously;If you listen to music, keep the volume low enough to hear what's around you.
169;Walking_at_dawn;Keep Your Phone Handy;Always have your phone easily accessible in case of emergencies.
170;Walking_at_dawn;Stay on Sidewalks;Make sure to walk on sidewalks instead of the road when possible.
171;Walking_at_dawn;Avoid Unfamiliar Areas;Don't wander into areas you don't know well, especially in the dark.
172;Walking_at_dawn;Be Cautious of Animals;Watch out for wildlife or stray animals that might be startled.
173;Walking_at_dawn;Trust Your Instincts;If something feels off, it’s best to turn around and leave the area.
174;Walking_at_dawn;Carry a Personal Alarm;Having a personal alarm can help alert others if you’re in trouble.
175;Walking_at_dawn;Inform Someone of Your Route;Let a friend or family member know where you're going.
176;Walking_at_dawn;Wear Comfortable Shoes;Make sure your shoes are appropriate for walking long distances.
177;Walking_at_dawn;Plan Your Route;Plan your walk in advance to avoid getting lost.
178;Walking_at_dawn;Hydrate;Bring water with you to stay hydrated while walking.
179;Walking_at_dawn;Avoid Distractions;Don’t get too absorbed in your phone or other distractions.
180;Walking_at_dawn;Dress for Weather;Make sure to wear clothes suitable for the weather conditions.
181;Walking_at_dawn;Practice Good Posture;Keep your head up and maintain a good posture while walking.
182;Walking_at_dawn;Stay Calm;If approached by anyone suspicious, stay calm and walk away confidently.
183;Walking_at_dawn;Know Emergency Contacts;Always have a list of emergency contacts readily available.
184;Walking_at_dawn;Stay on well-lit paths;Always choose the brighter trails when walking at dawn.
185;Walking_at_dawn;Wear reflective gear;Make sure to wear something reflective so drivers can see you.
186;Walking_at_dawn;Be aware of your surroundings;Keep an eye on what’s happening around you at all times.
187;Walking_at_dawn;Walk with a buddy;It’s safer to walk with a friend during early hours.
188;Walking_at_dawn;Carry a personal alarm;Having a personal alarm can provide extra safety just in case.
189;Walking_at_dawn;Avoid distractions;Put your phone away and stay focused while walking.
190;Walking_at_dawn;Know your route;Familiarize yourself with the area before you head out.
191;Walking_at_dawn;Listen to your instincts;If something doesn’t feel right, trust your gut and head back.
192;Walking_at_dawn;Check the weather;Make sure to check the morning weather before you go out.
193;Walking_at_dawn;Stay visible;Wear bright clothing to be seen easily
194;Walking_at_dawn;Be aware of surroundings;Keep your head up and listen for sounds
195;Walking_at_dawn;Walking with a partner;It's safer to walk with someone else at this hour
196;Walking_at_dawn;Stay on paths;Always stick to well-lit and familiar routes
197;Walking_at_dawn;Limit distractions;Put your phone away while walking
198;Walking_at_dawn;Use reflective accessories;Consider wearing a reflective vest or bands
199;Walking_at_dawn;Carry a flashlight;Bring a small flashlight for better visibility
200;Walking_at_dawn;Avoid dark alleys;Stay clear of secluded areas and shortcuts
201;Walking_at_dawn;Stay hydrated;Drink water before heading out in the morning
202;Walking_at_dawn;Trust your instincts;If something feels off, don't hesitate to turn back
203;Walking_at_dawn;Inform someone;Tell a friend or family member your route and time
204;Walking_at_dawn;Keep personal items secure;Use a crossbody bag to keep hands free
205;Walking_at_dawn;Plan your route;Know where you are going before you leave
206;Walking_at_dawn;Use a buddy system;Always have a walking buddy if possible
207;Walking_at_dawn;Observe wildlife;Be aware of local animals that may be out at dawn
208;Walking_at_dawn;Practice mindfulness;Focus on your surroundings and enjoy the moment
209;Walking_at_dawn;Check weather conditions;Make sure the weather is safe for a walk
210;Walking_at_dawn;Choose safe footwear;Wear comfortable and supportive walking shoes
211;Walking_at_dawn;Encountering strangers;Be polite but cautious around others you meet
212;Walking_at_dawn;Use pepper spray;Consider carrying pepper spray for added security
213;Walking_at_dawn;Wear visible clothing;Make sure to wear bright colors to be seen easily.
214;Walking_at_dawn;Stay on well-lit paths;Always choose streets that are well illuminated.
215;Walking_at_dawn;Carry a personal alarm;A personal alarm can help you feel safer.
216;Walking_at_dawn;Walk with a friend;It's safer to walk with someone else during dawn.
217;Walking_at_dawn;Avoid distractions;Don't use your phone while walking to stay alert.
218;Walking_at_dawn;Know your route;Plan your route in advance to avoid getting lost.
219;Walking_at_dawn;Be aware of your surroundings;Stay alert for any unusual activity around you.
220;Walking_at_dawn;Hurry but stay cautious;Walk briskly, but don't compromise on safety.
221;Walking_at_dawn;Pet friendly;If you have a dog, bring them along for extra safety.
222;Walking_at_dawn;Stay hydrated;Bring a bottle of water to stay hydrated.
223;Walking_at_dawn;Listen to music carefully;If you listen to music, keep the volume low.
224;Walking_at_dawn;Trust your instincts;If something feels off, trust your gut and leave.
225;Walking_at_dawn;Avoid secluded areas;Stick to populated areas where more people are around.
226;Walking_at_dawn;Hold your keys ready;Have your keys in hand before you reach home.
227;Walking_at_dawn;Watch for wildlife;Be cautious of any animals that may be out.
228;Walking_at_dawn;Use sidewalks when possible;Always stay on the sidewalks for safety.
229;Walking_at_dawn;Check the weather;Make sure the weather is suitable for walking.
230;Walking_at_dawn;Inform someone of your plan;Let someone know your walking route and time.
231;Walking_at_dawn;Keep your phone charged;Ensure your phone is charged in case you need it.
232;Walking_at_dawn;Practice mindfulness;Be present and observe the beauty around you.
233;Walking_at_dawn;Wear Reflective Clothing;Make sure to wear something bright to be seen by others.
234;Walking_at_dawn;Stay on Well-lit Paths;Always choose trails that are illuminated for safety.
235;Walking_at_dawn;Bring a Friend Along;It's safer to walk with someone else for company.
236;Walking_at_dawn;Keep Your Phone Handy;Have your phone ready in case you need to call for help.
237;Walking_at_dawn;Be Aware of Your Surroundings;Constantly check your surroundings for any approaching vehicles or people.
238;Walking_at_dawn;Avoid Headphones;Skip the music to stay aware of your environment while walking.
239;Walking_at_dawn;Plan Your Route;Always know your path before you start your walk.
240;Walking_at_dawn;Use Crosswalks;Cross streets only at marked crosswalks for safety.
241;Walking_at_dawn;Stay Alert for Wildlife;Keep an eye out for any animals that may be active at dawn.
242;Walking_at_dawn;Carry a Flashlight;A flashlight can help brighten dark areas and increase visibility.
243;Walking_at_dawn;Know Emergency Contacts;Be aware of who to call if something goes wrong.
244;Walking_at_dawn;Inform Someone of Your Plans;Let a family member know where you’ll be walking and when you’ll return.
245;Walking_at_dawn;Dress for Weather Conditions;Check the weather and dress appropriately to avoid discomfort.
246;Walking_at_dawn;Practice Safe Walking Etiquette;Step aside for faster walkers you may encounter on your path.
247;Walking_at_dawn;Set a Regular Schedule;Walking at the same time helps you to form a routine and stay safe.
248;Walking_at_dawn;Trust Your Instincts;If something feels off, don’t hesitate to change your path or head back.
249;Walking_at_dawn;Avoid Talking to Strangers;It's better to keep conversations brief and friendly from a distance.
250;Walking_at_dawn;Use a Personal Alarm;Carrying a personal alarm can deter unwanted attention.
251;Walking_at_dawn;Stay Hydrated Beforehand;Drink water before your walk to stay hydrated.
252;Walking_at_dawn;Listen to Your Body;If you feel tired or unwell, it's okay to skip your morning walk.
253;Walking_at_dawn;Wear reflective clothing;Always wear bright clothing to be seen.
254;Walking_at_dawn;Stay on populated paths;Stick to busy routes where others are walking.
255;Walking_at_dawn;Keep your phone handy;Make sure your phone is charged in case of emergencies.
256;Walking_at_dawn;Use headphones cautiously;If you wear headphones, keep the volume low to hear your surroundings.
257;Walking_at_dawn;Bring a buddy;It's safer to walk with someone else during early hours.
258;Walking_at_dawn;Stay aware of your surroundings;Keep an eye on what's happening around you.
259;Walking_at_dawn;Avoid distractions;Don't get too absorbed in your phone or music.
260;Walking_at_dawn;Trust your instincts;If something feels off, don’t hesitate to leave the area.
261;Walking_at_dawn;Establish a routine;Walk at the same time each morning for predictability.
262;Walking_at_dawn;Be mindful of wildlife;Watch for animals that might be active at dawn.
263;Walking_at_dawn;Carry a whistle;A whistle can alert others if you need help.
264;Walking_at_dawn;Avoid dark shortcuts;Stick to well-lit paths instead of through dark alleys.
265;Walking_at_dawn;Inform someone of your route;Let a friend know where you're heading.
266;Walking_at_dawn;Dress appropriately for weather;Check the weather before you head out.
267;Walking_at_dawn;Use crosswalks;Always cross at designated crosswalks for safety.
268;Walking_at_dawn;Stay hydrated;Bring a water bottle especially if it's warm.
269;Walking_at_dawn;Check for traffic;Look both ways before crossing streets.
270;Walking_at_dawn;Take breaks if needed;If you feel tired, find a safe spot to rest.
271;Walking_at_dawn;Learn self-defense basics;Consider taking a self-defense class for confidence.
